{
  "version": "1.0",
  "artifact": "BRAND_GUARD",
  "from_agent": "ju_brand_guard",
  "source_type": "script",
  "source_ref": "shorts/insulation_myth.json",
  "approved": true,
  "violations": [],
  "revised_copy": "",
  "checked_rules": [
    "no_hanok_or_traditional_implication",
    "no_unverified_savings_claims",
    "no_lowest_price_promise",
    "stage_accurate_visuals",
    "uses_2x6_studs"
  ],
  "created_at": "2026-08-07T13:05:00+09:00"
}
